[
  {
    "id": "WP-001",
    "title": "Charter and authority",
    "status": "CLOSED",
    "owner": "Michael Maillet",
    "approval": "APPROVED",
    "approval_ref": "governance/approvals/APR-002-wp001-s1-scope.md",
    "dependencies": [],
    "requirements": [
      "REQ-GOV-001",
      "REQ-GOV-002",
      "REQ-GOV-003",
      "REQ-LIC-001"
    ],
    "declaration": "governance/work-packages/WP-001.md",
    "acceptance_evidence": [
      "governance/closures/WP-001-manifest.json"
    ],
    "closure_approval_ref": "governance/approvals/APR-003-wp001-closure-and-deviations.md"
  },
  {
    "id": "WP-002",
    "title": "Requirements and standards crosswalk",
    "status": "ACTIVE",
    "owner": "Michael Maillet",
    "approval": "APPROVED",
    "approval_ref": "governance/approvals/APR-004-wp002-activation.md",
    "dependencies": [
      "WP-001"
    ],
    "requirements": [
      "REQ-GOV-001"
    ],
    "declaration": "governance/work-packages/WP-002.md",
    "acceptance_evidence": [],
    "closure_approval_ref": ""
  },
  {
    "id": "WP-003",
    "title": "Threat model and trust case",
    "status": "PLANNED",
    "owner": "Michael Maillet",
    "approval": "PENDING",
    "approval_ref": "",
    "dependencies": [
      "WP-002"
    ],
    "requirements": [
      "REQ-PRIV-001"
    ],
    "declaration": "governance/work-packages/WP-003.md",
    "acceptance_evidence": [],
    "closure_approval_ref": ""
  },
  {
    "id": "WP-004",
    "title": "Repository and environment bootstrap",
    "status": "PLANNED",
    "owner": "Michael Maillet",
    "approval": "PENDING",
    "approval_ref": "",
    "dependencies": [
      "WP-003"
    ],
    "requirements": [
      "REQ-LOCAL-001",
      "REQ-EVID-003",
      "REQ-ENV-001"
    ],
    "declaration": "governance/work-packages/WP-004.md",
    "acceptance_evidence": [],
    "closure_approval_ref": ""
  },
  {
    "id": "WP-005",
    "title": "Schemas and immutable evidence store",
    "status": "PLANNED",
    "owner": "Michael Maillet",
    "approval": "PENDING",
    "approval_ref": "",
    "dependencies": [
      "WP-004"
    ],
    "requirements": [
      "REQ-EVID-001",
      "REQ-EVID-002"
    ],
    "declaration": "governance/work-packages/WP-005.md",
    "acceptance_evidence": [],
    "closure_approval_ref": ""
  },
  {
    "id": "WP-006",
    "title": "Safe runner",
    "status": "PLANNED",
    "owner": "Michael Maillet",
    "approval": "PENDING",
    "approval_ref": "",
    "dependencies": [
      "WP-005"
    ],
    "requirements": [
      "REQ-SAFE-001"
    ],
    "declaration": "governance/work-packages/WP-006.md",
    "acceptance_evidence": [],
    "closure_approval_ref": ""
  },
  {
    "id": "WP-007",
    "title": "Intake and source model",
    "status": "PLANNED",
    "owner": "Michael Maillet",
    "approval": "PENDING",
    "approval_ref": "",
    "dependencies": [
      "WP-006"
    ],
    "requirements": [
      "REQ-INTAKE-001"
    ],
    "declaration": "governance/work-packages/WP-007.md",
    "acceptance_evidence": [],
    "closure_approval_ref": ""
  },
  {
    "id": "WP-008",
    "title": "Deterministic analyzer adapters",
    "status": "PLANNED",
    "owner": "Michael Maillet",
    "approval": "PENDING",
    "approval_ref": "",
    "dependencies": [
      "WP-007"
    ],
    "requirements": [
      "REQ-GOV-001"
    ],
    "declaration": "governance/work-packages/WP-008.md",
    "acceptance_evidence": [],
    "closure_approval_ref": ""
  },
  {
    "id": "WP-009",
    "title": "Finding fusion and reporting",
    "status": "PLANNED",
    "owner": "Michael Maillet",
    "approval": "PENDING",
    "approval_ref": "",
    "dependencies": [
      "WP-008"
    ],
    "requirements": [
      "REQ-CLAIM-001"
    ],
    "declaration": "governance/work-packages/WP-009.md",
    "acceptance_evidence": [],
    "closure_approval_ref": ""
  },
  {
    "id": "WP-010",
    "title": "Contract and property model",
    "status": "PLANNED",
    "owner": "Michael Maillet",
    "approval": "PENDING",
    "approval_ref": "",
    "dependencies": [
      "WP-009"
    ],
    "requirements": [
      "REQ-SEM-001"
    ],
    "declaration": "governance/work-packages/WP-010.md",
    "acceptance_evidence": [],
    "closure_approval_ref": ""
  },
  {
    "id": "WP-011",
    "title": "Hypothesis and mutation validation",
    "status": "PLANNED",
    "owner": "Michael Maillet",
    "approval": "PENDING",
    "approval_ref": "",
    "dependencies": [
      "WP-010"
    ],
    "requirements": [
      "REQ-GOV-001"
    ],
    "declaration": "governance/work-packages/WP-011.md",
    "acceptance_evidence": [],
    "closure_approval_ref": ""
  },
  {
    "id": "WP-012",
    "title": "CrossHair symbolic execution",
    "status": "PLANNED",
    "owner": "Michael Maillet",
    "approval": "PENDING",
    "approval_ref": "",
    "dependencies": [
      "WP-011"
    ],
    "requirements": [
      "REQ-GOV-001"
    ],
    "declaration": "governance/work-packages/WP-012.md",
    "acceptance_evidence": [],
    "closure_approval_ref": ""
  },
  {
    "id": "WP-013",
    "title": "SpecIR-to-SMT semantics",
    "status": "PLANNED",
    "owner": "Michael Maillet",
    "approval": "PENDING",
    "approval_ref": "",
    "dependencies": [
      "WP-012"
    ],
    "requirements": [
      "REQ-GOV-001"
    ],
    "declaration": "governance/work-packages/WP-013.md",
    "acceptance_evidence": [],
    "closure_approval_ref": ""
  },
  {
    "id": "WP-014",
    "title": "Z3 backend",
    "status": "PLANNED",
    "owner": "Michael Maillet",
    "approval": "PENDING",
    "approval_ref": "",
    "dependencies": [
      "WP-013"
    ],
    "requirements": [
      "REQ-GOV-001"
    ],
    "declaration": "governance/work-packages/WP-014.md",
    "acceptance_evidence": [],
    "closure_approval_ref": ""
  },
  {
    "id": "WP-015",
    "title": "Solver diversity",
    "status": "PLANNED",
    "owner": "Michael Maillet",
    "approval": "PENDING",
    "approval_ref": "",
    "dependencies": [
      "WP-014"
    ],
    "requirements": [
      "REQ-GOV-001"
    ],
    "declaration": "governance/work-packages/WP-015.md",
    "acceptance_evidence": [],
    "closure_approval_ref": ""
  },
  {
    "id": "WP-016",
    "title": "SymPy backend",
    "status": "PLANNED",
    "owner": "Michael Maillet",
    "approval": "PENDING",
    "approval_ref": "",
    "dependencies": [
      "WP-015"
    ],
    "requirements": [
      "REQ-GOV-001"
    ],
    "declaration": "governance/work-packages/WP-016.md",
    "acceptance_evidence": [],
    "closure_approval_ref": ""
  },
  {
    "id": "WP-017",
    "title": "Sage/Maxima diversity adapter",
    "status": "PLANNED",
    "owner": "Michael Maillet",
    "approval": "PENDING",
    "approval_ref": "",
    "dependencies": [
      "WP-016"
    ],
    "requirements": [
      "REQ-GOV-001"
    ],
    "declaration": "governance/work-packages/WP-017.md",
    "acceptance_evidence": [],
    "closure_approval_ref": ""
  },
  {
    "id": "WP-018",
    "title": "Dimensional and numerical analysis",
    "status": "PLANNED",
    "owner": "Michael Maillet",
    "approval": "PENDING",
    "approval_ref": "",
    "dependencies": [
      "WP-017"
    ],
    "requirements": [
      "REQ-GOV-001"
    ],
    "declaration": "governance/work-packages/WP-018.md",
    "acceptance_evidence": [],
    "closure_approval_ref": ""
  },
  {
    "id": "WP-019",
    "title": "Lean project and proof policy",
    "status": "PLANNED",
    "owner": "Michael Maillet",
    "approval": "PENDING",
    "approval_ref": "",
    "dependencies": [
      "WP-018"
    ],
    "requirements": [
      "REQ-GOV-001"
    ],
    "declaration": "governance/work-packages/WP-019.md",
    "acceptance_evidence": [],
    "closure_approval_ref": ""
  },
  {
    "id": "WP-020",
    "title": "SpecIR-to-Lean translation",
    "status": "PLANNED",
    "owner": "Michael Maillet",
    "approval": "PENDING",
    "approval_ref": "",
    "dependencies": [
      "WP-019"
    ],
    "requirements": [
      "REQ-GOV-001"
    ],
    "declaration": "governance/work-packages/WP-020.md",
    "acceptance_evidence": [],
    "closure_approval_ref": ""
  },
  {
    "id": "WP-021",
    "title": "Proof construction and replay",
    "status": "PLANNED",
    "owner": "Michael Maillet",
    "approval": "PENDING",
    "approval_ref": "",
    "dependencies": [
      "WP-020"
    ],
    "requirements": [
      "REQ-GOV-001"
    ],
    "declaration": "governance/work-packages/WP-021.md",
    "acceptance_evidence": [],
    "closure_approval_ref": ""
  },
  {
    "id": "WP-022",
    "title": "Source correspondence pilot",
    "status": "PLANNED",
    "owner": "Michael Maillet",
    "approval": "PENDING",
    "approval_ref": "",
    "dependencies": [
      "WP-021"
    ],
    "requirements": [
      "REQ-GOV-001"
    ],
    "declaration": "governance/work-packages/WP-022.md",
    "acceptance_evidence": [],
    "closure_approval_ref": ""
  },
  {
    "id": "WP-023",
    "title": "LLM reviewer adapter",
    "status": "PLANNED",
    "owner": "Michael Maillet",
    "approval": "PENDING",
    "approval_ref": "",
    "dependencies": [
      "WP-022"
    ],
    "requirements": [
      "REQ-GOV-001"
    ],
    "declaration": "governance/work-packages/WP-023.md",
    "acceptance_evidence": [],
    "closure_approval_ref": ""
  },
  {
    "id": "WP-024",
    "title": "Evidence-guided review planner",
    "status": "PLANNED",
    "owner": "Michael Maillet",
    "approval": "PENDING",
    "approval_ref": "",
    "dependencies": [
      "WP-023"
    ],
    "requirements": [
      "REQ-GOV-001"
    ],
    "declaration": "governance/work-packages/WP-024.md",
    "acceptance_evidence": [],
    "closure_approval_ref": ""
  },
  {
    "id": "WP-025",
    "title": "Calibrated verdict engine",
    "status": "PLANNED",
    "owner": "Michael Maillet",
    "approval": "PENDING",
    "approval_ref": "",
    "dependencies": [
      "WP-024"
    ],
    "requirements": [
      "REQ-GOV-001"